{
  "$schema": "http://json-schema.org/draft-07/schema#",
  "description": "Official Replicate API schema for google/nano-banana-pro",
  "properties": {
    "prompt": {
      "type": "string",
      "title": "Prompt",
      "x-order": 0,
      "description": "A text description of the image you want to generate"
    },
    "resolution": {
      "allOf": [
        {
          "$ref": "#/components/schemas/resolution"
        }
      ],
      "default": "2K",
      "x-order": 3,
      "description": "Resolution of the generated image"
    },
    "image_input": {
      "type": "array",
      "items": {
        "type": "string",
        "format": "uri"
      },
      "title": "Image Input",
      "default": [],
      "x-order": 1,
      "description": "Input images to transform or use as reference (supports up to 14 images)"
    },
    "aspect_ratio": {
      "allOf": [
        {
          "$ref": "#/components/schemas/aspect_ratio"
        }
      ],
      "default": "match_input_image",
      "x-order": 2,
      "description": "Aspect ratio of the generated image"
    },
    "output_format": {
      "allOf": [
        {
          "$ref": "#/components/schemas/output_format"
        }
      ],
      "default": "jpg",
      "x-order": 4,
      "description": "Format of the output image"
    },
    "safety_filter_level": {
      "allOf": [
        {
          "$ref": "#/components/schemas/safety_filter_level"
        }
      ],
      "default": "block_only_high",
      "x-order": 5,
      "description": "block_low_and_above is strictest, block_medium_and_above blocks some prompts, block_only_high is most permissive but some prompts will still be blocked"
    },
    "allow_fallback_model": {
      "type": "boolean",
      "title": "Allow Fallback Model",
      "default": false,
      "x-order": 6,
      "description": "Fallback to another model (currently bytedance/seedream-5) if Nano Banana Pro is at capacity."
    }
  },
  "required": ["prompt"],
  "title": "nano-banana-pro Input Schema",
  "type": "object"
}
