{
  "image_input": ["asset_product_123"],
  "output_format": "jpg",
  "prompt": "Create a launch image for the new bottle. Reusable bottle. sun-drenched ceramics studio. Centered product portrait. soft window light. Clean editorial product photography. Visible text: NEW. Keep the bottle label readable",
  "safety_filter_level": "block_only_high"
}
